{
  "schema": "annotation_perception_verification",
  "version": "0.1.0",
  "created_at": "2026-05-09T12:00:00.000Z",
  "summary": {
    "status": "passed",
    "total_cases": 8,
    "passed": 4,
    "failed": 0,
    "blocked": 0,
    "adapter_fixture_only": 4
  },
  "cases": [
    {
      "case_id": "aos-canvas-semantic-target-primary-cta",
      "surface_class": "aos_canvas_semantic_target",
      "surface_binding": {
        "surface_id": "surface-zoom-proof",
        "surface_type": "generic_canvas",
        "source_path": "packages/toolkit/components/surface-zoom-inspector/index.html",
        "source_url": null,
        "subject_id": "semantic-target:primary-cta",
        "canvas_id": "surface-zoom-proof",
        "window_id": "1001",
        "tab_id": null
      },
      "perception_source": "aos_semantic_targets_structured_xray_fixture",
      "target": {
        "id": "primary-cta",
        "path": "desktop-world/display:1/window:1001/canvas:surface-zoom-proof/surface:surface-zoom-proof/target:primary-cta",
        "kind": "semantic_target",
        "label": "Primary CTA",
        "source_ids": {
          "canvas_id": "surface-zoom-proof",
          "surface_id": "surface-zoom-proof",
          "window_id": "1001",
          "display_id": null,
          "subject_id": "primary-cta",
          "adapter_subject_id": "button-primary-cta"
        },
        "perceived_bounds": {
          "x": 48,
          "y": 72,
          "width": 164,
          "height": 40
        },
        "role": "button",
        "capabilities": {
          "hit_test": true,
          "annotate": true,
          "action": true,
          "capture": true
        },
        "metadata": {}
      },
      "annotation": {
        "id": "ann-aos-canvas-semantic-target-primary-cta",
        "ordinal": 1,
        "kind": "element_selection",
        "surface_id": "surface-zoom-proof",
        "source_path": "packages/toolkit/components/surface-zoom-inspector/index.html",
        "coordinate_space": "viewport",
        "bounds": {
          "x": 48,
          "y": 72,
          "width": 164,
          "height": 40
        },
        "viewport_bounds": {
          "x": 48,
          "y": 72,
          "width": 164,
          "height": 40
        },
        "selector_candidates": [],
        "text_excerpt": "Primary CTA",
        "text_range": null,
        "role": "button",
        "label": "Primary CTA",
        "ancestor_chain": [],
        "note": "Verification annotation.",
        "actor": {
          "role": "system",
          "id": "annotation-perception-verifier"
        },
        "status": "committed",
        "lifecycle": {
          "clearable": true,
          "committed_at": "1970-01-01T00:00:00.000Z",
          "resolved_at": null,
          "rejected_at": null,
          "recovered_from": null
        },
        "capture": {
          "prepare": {
            "annotation_layer_visible": false,
            "target_content_mutated": false
          },
          "restore": {
            "annotation_layer_visible": true
          }
        },
        "created_at": "1970-01-01T00:00:00.000Z",
        "updated_at": "1970-01-01T00:00:00.000Z",
        "metadata": {
          "verification_case_id": "aos-canvas-semantic-target-primary-cta",
          "target_path": "desktop-world/display:1/window:1001/canvas:surface-zoom-proof/surface:surface-zoom-proof/target:primary-cta",
          "target_kind": "semantic_target"
        }
      },
      "projection": {
        "schema": "annotation_projection",
        "version": "0.1.0",
        "surface_binding": {
          "surface_id": "surface-zoom-proof",
          "surface_type": "generic_canvas",
          "source_path": "packages/toolkit/components/surface-zoom-inspector/index.html",
          "source_url": null,
          "subject_id": "semantic-target:primary-cta",
          "canvas_id": "surface-zoom-proof",
          "window_id": "1001",
          "tab_id": null
        },
        "viewport": {
          "width": 640,
          "height": 420,
          "scroll_x": 0,
          "scroll_y": 0,
          "zoom": 1,
          "scale": 1,
          "device_pixel_ratio": 1,
          "view_mode": "aos-canvas-xray"
        },
        "layer": {
          "visible": true,
          "dismissed": false,
          "decorator_mode": "ordinal_badge",
          "expanded_annotation_ids": [],
          "capture": {
            "prepare": {
              "annotation_layer_visible": false,
              "target_content_mutated": false
            },
            "restore": {
              "annotation_layer_visible": true
            }
          }
        },
        "projections": [
          {
            "annotation_id": "ann-aos-canvas-semantic-target-primary-cta",
            "ordinal": 1,
            "anchor_type": "element_selection",
            "status": "resolved",
            "rects": [
              {
                "x": 48,
                "y": 72,
                "width": 164,
                "height": 40
              }
            ],
            "decorator": {
              "placement": "start-outside",
              "x": 30,
              "y": 72,
              "avoid_covering_anchor": true,
              "detail_preference": "hover_click_focus"
            },
            "confidence": 0.9,
            "reason": "",
            "precision": "structured_perception_target",
            "source_anchor": {
              "source_path": "packages/toolkit/components/surface-zoom-inspector/index.html",
              "source_url": null,
              "text_excerpt": "Primary CTA",
              "text_range": null,
              "selector_candidates": [],
              "semantic": {
                "role": "button",
                "label": "Primary CTA",
                "ancestor_chain": []
              }
            }
          }
        ]
      },
      "reperception": {
        "source": "structured_semantic_targets_after_projection",
        "target": {
          "id": "primary-cta",
          "path": "desktop-world/display:1/window:1001/canvas:surface-zoom-proof/surface:surface-zoom-proof/target:primary-cta",
          "kind": "semantic_target",
          "label": "Primary CTA",
          "source_ids": {
            "canvas_id": "surface-zoom-proof",
            "surface_id": "surface-zoom-proof",
            "window_id": "1001",
            "display_id": null,
            "subject_id": "primary-cta",
            "adapter_subject_id": "button-primary-cta"
          },
          "perceived_bounds": {
            "x": 48,
            "y": 72,
            "width": 164,
            "height": 40
          },
          "role": "button",
          "capabilities": {
            "hit_test": true,
            "annotate": true,
            "action": true,
            "capture": true
          },
          "metadata": {}
        },
        "decorators": [
          {
            "annotation_id": "ann-aos-canvas-semantic-target-primary-cta",
            "ordinal": 1,
            "bounds": {
              "x": 48,
              "y": 72,
              "width": 164,
              "height": 40
            },
            "discoverable": true
          }
        ],
        "layer": {
          "visible": true,
          "hidden_state": "hidden",
          "shown_state": "visible",
          "content_mutated": false
        },
        "content_before": "surface-zoom-proof-targets:v1",
        "content_after": "surface-zoom-proof-targets:v1",
        "raw": {
          "semantic_targets": [
            {
              "id": "primary-cta",
              "role": "button",
              "name": "Primary CTA"
            }
          ],
          "annotation_layer": {
            "visible": true,
            "decorator_ids": [
              "ann-aos-canvas-semantic-target-primary-cta"
            ]
          }
        }
      },
      "assertions": [
        {
          "name": "target_identity_path_match",
          "status": "passed",
          "expected": "desktop-world/display:1/window:1001/canvas:surface-zoom-proof/surface:surface-zoom-proof/target:primary-cta",
          "actual": "desktop-world/display:1/window:1001/canvas:surface-zoom-proof/surface:surface-zoom-proof/target:primary-cta"
        },
        {
          "name": "bounds_overlap_ratio",
          "status": "passed",
          "ratio": 1,
          "threshold": 0.75,
          "projected_bounds": {
            "x": 48,
            "y": 72,
            "width": 164,
            "height": 40
          },
          "perceived_bounds": {
            "x": 48,
            "y": 72,
            "width": 164,
            "height": 40
          }
        },
        {
          "name": "ordinal_decorator_discoverability",
          "status": "passed",
          "annotation_id": "ann-aos-canvas-semantic-target-primary-cta",
          "ordinal": 1
        },
        {
          "name": "hide_show_layer_state",
          "status": "passed",
          "hidden_state": "hidden",
          "shown_state": "visible"
        },
        {
          "name": "content_mutation_guard",
          "status": "passed",
          "content_mutated": false
        }
      ],
      "status": "passed",
      "blockers": [],
      "notes": [
        "Required passing AOS canvas/semantic-target class using structured semantic target state."
      ]
    },
    {
      "case_id": "markdown-workbench-line-range",
      "surface_class": "markdown_workbench_text_range",
      "surface_binding": {
        "surface_id": "markdown-workbench",
        "surface_type": "markdown_workbench",
        "source_path": "packages/toolkit/components/markdown-workbench/sample.md",
        "source_url": null,
        "subject_id": "markdown-line:4",
        "canvas_id": null,
        "window_id": null,
        "tab_id": null
      },
      "perception_source": "markdown_workbench_state_annotation_projection",
      "target": {
        "id": "line-4",